{
  "$schema": "http://json-schema.org/draft-07/schema#",
  "title": "code-navigation-python-v1",
  "type": "object",
  "additionalProperties": false,
  "required": [
    "schema_version",
    "fixture_seed",
    "fixture_lines",
    "python_min",
    "pyright_version",
    "pyright_package_sha256",
    "node_major",
    "definition_queries",
    "reference_queries",
    "call_queries",
    "edit_rename_delete_cycles",
    "crash_cycles",
    "default_limit",
    "max_estimated_tokens",
    "expected_source_manifest_sha256",
    "expected_gold_sha256",
    "market_superiority_claimed"
  ],
  "properties": {
    "schema_version": {"const": "code-navigation-python/v1"},
    "fixture_seed": {"const": 411},
    "fixture_lines": {"const": 100000},
    "python_min": {"const": "3.10"},
    "pyright_version": {"const": "1.1.411"},
    "pyright_package_sha256": {"const": "bd5c488fc20fa237a944279bf32cae2f986cf10d5d5d9e8705819859daeb2f4a"},
    "node_major": {"const": 22},
    "definition_queries": {"const": 200},
    "reference_queries": {"const": 100},
    "call_queries": {"const": 100},
    "edit_rename_delete_cycles": {"const": 50},
    "crash_cycles": {"const": 20},
    "default_limit": {"const": 10},
    "max_estimated_tokens": {"const": 1200},
    "expected_source_manifest_sha256": {"const": "30f0b042afc971426f9e0c8e6fa8f1c9446976de82a427acda3d1ec9eb0e31e8"},
    "expected_gold_sha256": {"const": "da2ddb5b6ef245a388b7fa4142770aa25e0580319df16af6ac7475a3c0455a5f"},
    "market_superiority_claimed": {"const": false}
  }
}
