{
  "schema_version": "code-navigation-python/v1",
  "fixture_seed": 411,
  "fixture_lines": 100000,
  "python_min": "3.10",
  "pyright_version": "1.1.411",
  "pyright_package_sha256": "bd5c488fc20fa237a944279bf32cae2f986cf10d5d5d9e8705819859daeb2f4a",
  "node_major": 22,
  "definition_queries": 200,
  "reference_queries": 100,
  "call_queries": 100,
  "edit_rename_delete_cycles": 50,
  "crash_cycles": 20,
  "default_limit": 10,
  "max_estimated_tokens": 1200,
  "expected_source_manifest_sha256": "30f0b042afc971426f9e0c8e6fa8f1c9446976de82a427acda3d1ec9eb0e31e8",
  "expected_gold_sha256": "da2ddb5b6ef245a388b7fa4142770aa25e0580319df16af6ac7475a3c0455a5f",
  "market_superiority_claimed": false
}
